{
  "metadata": {
    "constants": {
      "maxUint256": "0xffffffffffffffffffffffffffffffffffffffffffffffffffffffffffffffff"
    }
  },
  "display": {
    "definitions": {
      "erc20Amount": {
        "label": "Amount",
        "format": "tokenAmount",
        "params": {
          "tokenPath": "@.to"
        }
      }
    }
  },
  "groups": {
    "erc20": {
      "label": "ERC-20",
      "order": 99
    }
  },
  "functions": {
    "name()": {
      "title": "Token Name",
      "signature": "name()",
      "description": "The name of the token.",
      "stateMutability": "view",
      "group": "erc20"
    },
    "symbol()": {
      "title": "Token Symbol",
      "signature": "symbol()",
      "description": "The token symbol.",
      "stateMutability": "view",
      "group": "erc20"
    },
    "decimals()": {
      "title": "Decimals",
      "signature": "decimals()",
      "description": "Number of decimal places used by the token.",
      "stateMutability": "view",
      "group": "erc20"
    },
    "totalSupply()": {
      "title": "Total Supply",
      "signature": "totalSupply()",
      "description": "Total amount of tokens in existence.",
      "stateMutability": "view",
      "group": "erc20"
    },
    "balanceOf(address account)": {
      "title": "Balance",
      "signature": "balanceOf(address account)",
      "description": "Check the token balance of an address.",
      "stateMutability": "view",
      "group": "erc20",
      "fields": [
        {
          "path": "account",
          "label": "Holder",
          "format": "addressName"
        }
      ]
    },
    "allowance(address owner,address spender)": {
      "title": "Allowance",
      "signature": "allowance(address owner,address spender)",
      "description": "Check how many tokens an address has approved another address to spend.",
      "stateMutability": "view",
      "group": "erc20",
      "fields": [
        {
          "path": "owner",
          "label": "Owner",
          "format": "addressName"
        },
        {
          "path": "spender",
          "label": "Spender",
          "format": "addressName"
        }
      ]
    },
    "approve(address spender,uint256 value)": {
      "title": "Approve",
      "signature": "approve(address spender,uint256 value)",
      "description": "Approve a spender to transfer up to the given amount of your tokens.",
      "group": "erc20",
      "intent": "Approve",
      "interpolatedIntent": "Approve {spender} to spend {value}",
      "warning": "Approving unlimited amounts is common but carries risk if the spender contract is compromised.",
      "fields": [
        {
          "path": "spender",
          "label": "Spender",
          "format": "addressName"
        },
        {
          "path": "value",
          "label": "Amount",
          "format": "tokenAmount",
          "params": {
            "tokenPath": "@.to",
            "threshold": "0xffffffffffffffffffffffffffffffffffffffffffffffffffffffffffffffff",
            "message": "Unlimited"
          }
        }
      ],
      "related": [
        "allowance",
        "transferFrom"
      ]
    },
    "transfer(address to,uint256 value)": {
      "title": "Transfer",
      "signature": "transfer(address to,uint256 value)",
      "description": "Transfer tokens to another address.",
      "group": "erc20",
      "intent": "Send",
      "interpolatedIntent": "Send {value} to {to}",
      "fields": [
        {
          "path": "value",
          "label": "Amount",
          "format": "tokenAmount",
          "params": {
            "tokenPath": "@.to"
          }
        },
        {
          "path": "to",
          "label": "To",
          "format": "addressName"
        }
      ],
      "related": [
        "balanceOf"
      ]
    },
    "transferFrom(address from,address to,uint256 value)": {
      "title": "Transfer From",
      "signature": "transferFrom(address from,address to,uint256 value)",
      "description": "Transfer tokens from one address to another, using a previously set allowance.",
      "group": "erc20",
      "intent": "Transfer from allowance",
      "interpolatedIntent": "Transfer {value} from {from} to {to}",
      "fields": [
        {
          "path": "from",
          "label": "From",
          "format": "addressName"
        },
        {
          "path": "to",
          "label": "To",
          "format": "addressName"
        },
        {
          "path": "value",
          "label": "Amount",
          "format": "tokenAmount",
          "params": {
            "tokenPath": "@.to"
          }
        }
      ],
      "related": [
        "approve",
        "allowance"
      ]
    }
  },
  "events": {
    "Transfer": {
      "description": "Emitted when tokens are transferred.",
      "params": {
        "from": {
          "label": "from"
        },
        "to": {
          "label": "to"
        },
        "value": {
          "label": "amount"
        }
      }
    },
    "Approval": {
      "description": "Emitted when an approval is set.",
      "params": {
        "owner": {
          "label": "owner"
        },
        "spender": {
          "label": "spender"
        },
        "value": {
          "label": "amount"
        }
      }
    }
  }
}
